{
  "$schema": "https://hairness.dev/schema/asset.json",
  "name": "hairness/onboarding",
  "version": "0.4.0-alpha.0",
  "description": "The minimal operating contract, orientation and consensual onboarding for a Hairness Home.",
  "files": [
    {
      "path": "instructions/home.md",
      "type": "hairness:instruction"
    },
    {
      "path": "skills/hairness/SKILL.md",
      "type": "hairness:skill",
      "id": "hairness",
      "description": "Orient the user and show the next useful route."
    },
    {
      "path": "skills/hairness-onboarding/SKILL.md",
      "type": "hairness:skill",
      "id": "hairness-onboarding",
      "description": "Configure the smallest useful Home through conversation."
    }
  ]
}
