{
  "$schema": "https://hairness.dev/schema/asset.json",
  "name": "hairness/scratch",
  "version": "0.4.0-alpha.1",
  "description": "Explicit, lightweight working memory owned by the Home instance.",
  "files": [
    {
      "path": "skills/hairness-scratch/SKILL.md",
      "type": "hairness:skill",
      "id": "hairness-scratch",
      "description": "Create or update explicit lightweight working memory."
    }
  ]
}
