{
  "$schema": "https://hairness.dev/schema/asset.json",
  "name": "hairness/project",
  "version": "0.4.0-alpha.0",
  "description": "Maintainer instructions, architecture knowledge and delivery Skills for the Hairness Target.",
  "files": [
    {
      "path": "instructions/maintaining-hairness.md",
      "type": "hairness:instruction"
    },
    {
      "path": "knowledge/architecture.md",
      "type": "hairness:file"
    },
    {
      "path": "skills/hairness-review/SKILL.md",
      "type": "hairness:skill",
      "id": "hairness-review",
      "description": "Review a Hairness change against its public contracts and qualification gates."
    },
    {
      "path": "skills/hairness-release/SKILL.md",
      "type": "hairness:skill",
      "id": "hairness-release",
      "description": "Prepare a resumable Hairness prerelease without crossing approval checkpoints."
    }
  ]
}
